title, link, date
Brutal! Ulah Pemotor Hindari Razia di Surabaya,https://news.detik.com/detiktv/d-3656195/brutal-ulah-pemotor-hindari-razia-di-surabaya,DETIKNEWS | Minggu 24 September 2017| 18:33 WIB
Pembubaran Ibadah di Rusun Bikin Kadis Perumahan Geram,https://news.detik.com/detiktv/d-3656192/pembubaran-ibadah-di-rusun-bikin-kadis-perumahan-geram,DETIKNEWS | Minggu 24 September 2017| 18:28 WIB
Mbah Ledja di Makamkan di Makam Seniman Imogiri| Bantul,https://news.detik.com/berita-jawa-tengah/d-3656194/mbah-ledja-di-makamkan-di-makam-seniman-imogiri-bantul,DETIKNEWS | Minggu 24 September 2017| 18:27 WIB
Pembelian 500 Senjata BIN Dianggap Penyelundupan| ini Penyebabnya,https://news.detik.com/berita/d-3656190/pembelian-500-senjata-bin-dianggap-penyelundupan-ini-penyebabnya,DETIKNEWS | Minggu 24 September 2017| 18:16 WIB
Seorang Santri Tewas Tenggelam di Kolam Renang,https://news.detik.com/berita-jawa-tengah/d-3656171/seorang-santri-tewas-tenggelam-di-kolam-renang,DETIKNEWS | Minggu 24 September 2017| 18:11 WIB
Wiranto: BIN Beli Senjata untuk Pendidikan Intel| Bukan Penyelundupan,https://news.detik.com/berita/d-3656169/wiranto-bin-beli-senjata-untuk-pendidikan-intel-bukan-penyelundupan,DETIKNEWS | Minggu 24 September 2017| 18:02 WIB
Wiranto Soal Remake Film G30S: Agar Mudah Dipahami Generasi Milenial,https://news.detik.com/berita/d-3656168/wiranto-soal-remake-film-g30s-agar-mudah-dipahami-generasi-milenial,DETIKNEWS | Minggu 24 September 2017| 18:00 WIB
Polisi Cek Dugaan Anak-anak Jadi Cek Klien nikahsirri.com,https://news.detik.com/berita/d-3656167/polisi-cek-dugaan-anak-anak-jadi-cek-klien-nikahsirricom,DETIKNEWS | Minggu 24 September 2017| 17:58 WIB
Isu Penyelundupan Senjata| Wiranto: Itu Pengadaan BIN| Miskomunikasi Saja,https://news.detik.com/berita/d-3656165/isu-penyelundupan-senjata-wiranto-itu-pengadaan-bin-miskomunikasi-saja,DETIKNEWS | Minggu 24 September 2017| 17:54 WIB
Berakhir Damai| Pembubaran Ibadah di Rusun Pulo Gebang,https://news.detik.com/detiktv/d-3656156/berakhir-damai-pembubaran-ibadah-di-rusun-pulo-gebang,DETIKNEWS | Minggu 24 September 2017| 17:50 WIB
Wiranto Sebut Ajakan Nobar Film G30S/PKI Hal yang Wajar,https://news.detik.com/berita/d-3656163/wiranto-sebut-ajakan-nobar-film-g30spki-hal-yang-wajar,DETIKNEWS | Minggu 24 September 2017| 17:48 WIB
Bupati Anas di Kursus Politik| PDIP: Tak Berkaitan Pilgub Jatim,https://news.detik.com/berita/d-3656160/bupati-anas-di-kursus-politik-pdip-tak-berkaitan-pilgub-jatim,DETIKNEWS | Minggu 24 September 2017| 17:37 WIB
Sempat Berselisih| Opang Cibiru dan Ojek Online Sepakat Damai,https://news.detik.com/berita-jawa-barat/d-3656159/sempat-berselisih-opang-cibiru-dan-ojek-online-sepakat-damai,DETIKNEWS | Minggu 24 September 2017| 17:31 WIB
Pakar China: Gempa 3|5 SR di Korut Bukan Akibat Uji Coba Nuklir,https://news.detik.com/internasional/d-3656157/pakar-china-gempa-35-sr-di-korut-bukan-akibat-uji-coba-nuklir,DETIKNEWS | Minggu 24 September 2017| 17:30 WIB
Survei Alvara: Azwar Anas Paling Potensial Jadi Cawagub,https://news.detik.com/berita/d-3656158/survei-alvara-azwar-anas-paling-potensial-jadi-cawagub,DETIKNEWS | Minggu 24 September 2017| 17:25 WIB
Polisi Sebut 3 Ribu Orang Sudah Daftar di Situs nikahsirri.com,https://news.detik.com/berita/d-3656154/polisi-sebut-3-ribu-orang-sudah-daftar-di-situs-nikahsirricom,DETIKNEWS | Minggu 24 September 2017| 17:16 WIB
Gus Ipul dan Khofifah Head to Head| ini Hasilnya Versi Survei Alvara,https://news.detik.com/berita/d-3656137/gus-ipul-dan-khofifah-head-to-head-ini-hasilnya-versi-survei-alvara,DETIKNEWS | Minggu 24 September 2017| 16:59 WIB
Masih Digaris Polisi| Ini Kosan Murti yang Dibunuh Agus Lee Min Ho,https://news.detik.com/berita/d-3656134/masih-digaris-polisi-ini-kosan-murti-yang-dibunuh-agus-lee-min-ho,DETIKNEWS | Minggu 24 September 2017| 16:53 WIB
Bupati Klungkung Jamin Pendidikan Anak-anak Pengungsi Gunung Agung,https://news.detik.com/berita/d-3656121/bupati-klungkung-jamin-pendidikan-anak-anak-pengungsi-gunung-agung,DETIKNEWS | Minggu 24 September 2017| 16:51 WIB
Uang Cash Miliaran Rupiah Istri Fuad Amin Juga Ikut Dirampas,https://news.detik.com/berita/d-3656132/uang-cash-miliaran-rupiah-istri-fuad-amin-juga-ikut-dirampas,DETIKNEWS | Minggu 24 September 2017| 16:48 WIB
3 Cagub Sulsel Bersaing Ketat di Survei Poltracking,https://news.detik.com/berita/d-3656114/3-cagub-sulsel-bersaing-ketat-di-survei-poltracking,DETIKNEWS | Minggu 24 September 2017| 16:24 WIB
Cak Imin Rayakan Ultah ke-51 dengan Luncurkan 2 Buku,https://news.detik.com/berita/d-3656116/cak-imin-rayakan-ultah-ke-51-dengan-luncurkan-2-buku,DETIKNEWS | Minggu 24 September 2017| 16:23 WIB
Satwa Asli Mati Akibat Dibangunnya Pagar Pencegah Anjing Liar,https://news.detik.com/australia-plus-abc/d-3655930/satwa-asli-mati-akibat-dibangunnya-pagar-pencegah-anjing-liar,DETIKNEWS | Minggu 24 September 2017| 16:12 WIB
Jokowi Main ke Mal Bersama Cucu di Kelapa Gading,https://news.detik.com/berita/d-3656088/jokowi-main-ke-mal-bersama-cucu-di-kelapa-gading,DETIKNEWS | Minggu 24 September 2017| 15:57 WIB
Gubernur Bali: Turis Jangan Dekat-dekat Gunung Agung Dulu,https://news.detik.com/berita/d-3656086/gubernur-bali-turis-jangan-dekat-dekat-gunung-agung-dulu,DETIKNEWS | Minggu 24 September 2017| 15:41 WIB
Pemprov Bali Ambil Alih Distribusi Bantuan Pengungsi Gunung Agung,https://news.detik.com/berita/d-3656080/pemprov-bali-ambil-alih-distribusi-bantuan-pengungsi-gunung-agung,DETIKNEWS | Minggu 24 September 2017| 15:31 WIB
Serikat Buruh Minta Pemerintah Jamin Pengepungan LBH Tak Terulang,https://news.detik.com/berita/d-3656089/serikat-buruh-minta-pemerintah-jamin-pengepungan-lbh-tak-terulang,DETIKNEWS | Minggu 24 September 2017| 15:31 WIB
Bangladesh Larang Jual Kartu SIM HP ke Pengungsi Rohingya,https://news.detik.com/internasional/d-3656058/bangladesh-larang-jual-kartu-sim-hp-ke-pengungsi-rohingya,DETIKNEWS | Minggu 24 September 2017| 15:22 WIB
Banyak Kepala Daerah Kena OTT KPK| Ketum PAN Salahkan Sistem,https://news.detik.com/berita/d-3656056/banyak-kepala-daerah-kena-ott-kpk-ketum-pan-salahkan-sistem,DETIKNEWS | Minggu 24 September 2017| 15:16 WIB
Gunung Agung Awas| Menko Luhut Tinjau Pos Pengungsian di Klungkung,https://news.detik.com/berita/d-3656053/gunung-agung-awas-menko-luhut-tinjau-pos-pengungsian-di-klungkung,DETIKNEWS | Minggu 24 September 2017| 15:14 WIB
Gunung Agung Awas| Gubernur Bali Tetapkan Tanggap Darurat Provinsi,https://news.detik.com/berita/d-3656055/gunung-agung-awas-gubernur-bali-tetapkan-tanggap-darurat-provinsi,DETIKNEWS | Minggu 24 September 2017| 15:13 WIB
Cerita Peternak Kambing ke Jokowi soal 'Uang Bensin',https://news.detik.com/berita/d-3656054/cerita-peternak-kambing-ke-jokowi-soal-uang-bensin,DETIKNEWS | Minggu 24 September 2017| 15:13 WIB
Cerita Saksi soal Peran Istri Fuad Amin Si Koruptor Rp 414 Miliar,https://news.detik.com/berita/d-3656049/cerita-saksi-soal-peran-istri-fuad-amin-si-koruptor-rp-414-miliar,DETIKNEWS | Minggu 24 September 2017| 15:07 WIB
TNUK Lakukan Tes DNA Feses Kucing Besar Diduga Harimau Jawa,https://news.detik.com/berita/d-3656051/tnuk-lakukan-tes-dna-feses-kucing-besar-diduga-harimau-jawa,DETIKNEWS | Minggu 24 September 2017| 15:01 WIB
Warna Pelat Kendaraan akan Diganti Agar Ramah CCTV,https://news.detik.com/detiktv/d-3656030/warna-pelat-kendaraan-akan-diganti-agar-ramah-cctv,DETIKNEWS | Minggu 24 September 2017| 14:53 WIB
Ini Lokasi Ranger TNUK Pergoki Kucing Besar Diduga Harimau Jawa,https://news.detik.com/berita/d-3656034/ini-lokasi-ranger-tnuk-pergoki-kucing-besar-diduga-harimau-jawa,DETIKNEWS | Minggu 24 September 2017| 14:49 WIB
Karnaval Pelajar Kostum Unik Ramaikan HUT Polantas Cianjur,https://news.detik.com/foto-news/d-3656023/karnaval-pelajar-kostum-unik-ramaikan-hut-polantas-cianjur,DETIKPHOTO | Minggu 24 September 2017| 14:47 WIB
Sanggah Murti PSK| Teman Sekos: Dia Begitu Kalau Kepepet Saja,https://news.detik.com/berita/d-3656032/sanggah-murti-psk-teman-sekos-dia-begitu-kalau-kepepet-saja,DETIKNEWS | Minggu 24 September 2017| 14:46 WIB
Pengamat: Dedi Mulyadi Berpeluang Diusung PDIP di Pilgub Jabar,https://news.detik.com/berita-jawa-barat/d-3656031/pengamat-dedi-mulyadi-berpeluang-diusung-pdip-di-pilgub-jabar,DETIKNEWS | Minggu 24 September 2017| 14:45 WIB
Mengeluh Nyeri Dada| Jemaah Haji Aceh Meninggal di Madinah,https://news.detik.com/berita/d-3656029/mengeluh-nyeri-dada-jemaah-haji-aceh-meninggal-di-madinah,DETIKNEWS | Minggu 24 September 2017| 14:30 WIB
